{
 "schema": "wakeel.journey-graph.v0.3",
 "schema_uri": "schema/wakeel-journey.schema.json",
 "date": "2026-10-29",
 "status": "V0.21.3_44_STATIONS_9_AUTHORED_CHAPTERS",
 "separation_rule_ar": "هذا الملف يعبّر عن تجربة تعليمية مرتّبة، لا عن حقيقة معرفية. لا تُقرأ محطاته كمتطلبات علمية، ولا تُدمج حوافه في سجل العلاقات. الترتيب هنا قرار تصميم تدريس، وقد يخالفه ترتيب الاعتماد العلمي بين الموضوعين نفسيهما.",
 "station_roles": {
  "core": "محطة أساسية في مسار الرحلة؛ لها نشاط ومخرج يتحقق منه المتعلم.",
  "optional": "تُفتح عند الحاجة فقط؛ يمكن إتمام الرحلة دونها مع تمهيد موجز داخل المحطة التي تحتاجها.",
  "reference": "مادة مرجعية مرتبطة بالرحلة لا تُدرج في تسلسلها."
 },
 "journeys": [
  {
   "id": "JRN-LLM-001",
   "title_ar": "من السؤال الإنساني إلى نموذج لغوي صغير يعمل ويُقاس",
   "title_en": "From a human question to a small language model that runs and is measured",
   "status": "built",
   "nature": "pedagogical_order",
   "goal_ar": "أن يبني المتعلم نموذجاً لغوياً صغيراً من الصفر، ويدرّبه، ويتحقق من سلامته قبل التشغيل، ويقيسه بخط أساس ثابت، ويشغّله — مع فهم سبب كل خطوة لا حفظ ترتيبها.",
   "starts_with_question_ar": "كيف نجعل الحاسوب يتعامل مع اللغة؟ ولماذا أصبح توقع الرمز التالي إحدى الطرق المهمة لتدريب النماذج اللغوية؟",
   "independence_note_ar": "كل محطة هنا رابط مستقل إلى موضوعه. لم تُصمم الرحلة لتكون بوابة؛ من يريد Tokenizer وحده يدخل NLP-003 مباشرة ويجد تمهيده الموجز داخلها.",
   "exit_evidence_ar": [
    "نموذج صغير يعمل من البداية إلى النهاية على نص اختاره المتعلم.",
    "تقرير تقييم على مجموعة تحقق منفصلة، ببيانات ثابتة وخط أساس وتكرار واحد على الأقل، يذكر صراحة ما لم يتحسن.",
    "اختبار تسرب مكتوب قبل تشغيل التدريب، يفشل عند التسرب وينجح على النموذج السببي.",
    "مقارنة بين استراتيجيتي فك ترميز على المطالبة نفسها، مع تفسير الفرق.",
    "اختبار ربط تركيبي بأزواج مضادة يفصل الربط عن تعداد الرموز، مع ضابط اختصار معلن على السؤال الثاني وقراءة بذور مشروطة بحدودها."
   ],
   "chapters": [
    {
     "id": "CH-1",
     "title_ar": "من الحاجة إلى السؤال",
     "station_orders": [
      1,
      2,
      3,
      4,
      5
     ],
     "goal_ar": "أن يصل المتعلم إلى قرار «نحتاج تعلماً من أمثلة» من تجربة قواعد فاشلة، لا من تصريح.",
     "content": {
      "ar": "content/chapter-01/ar.md",
      "en": "content/chapter-01/en.md",
      "status": "authored"
     },
     "title_en": "From Need to Question",
     "goal_en": "That the learner arrive at 'we need learning from examples' through an experiment with failing rules, not from a declaration."
    },
    {
     "id": "CH-2",
     "title_ar": "اللغة تصبح وحدات",
     "station_orders": [
      6,
      7,
      8
     ],
     "goal_ar": "أن ينتقل من اختيار رد إلى فكرة كتابة نص جديد خطوة بخطوة، ثم يكتشف أن الكتابة تحتاج وحدة، فيصل إلى التقطيع بدافع لا بأمر.",
     "content": {
      "ar": "content/chapter-02/ar.md",
      "en": "content/chapter-02/en.md",
      "status": "authored"
     },
     "title_en": "Language Becomes Units",
     "goal_en": "That they move from choosing a reply to writing new text step by step, then discover that writing needs a unit, reaching tokenization from motive rather than command."
    },
    {
     "id": "CH-3",
     "title_ar": "أول نموذج: من العد إلى الأوزان",
     "station_orders": [
      9,
      10,
      11,
      12,
      13,
      14,
      15,
      16
     ],
     "goal_ar": "أن ينتقل من وحدات مرقمة إلى أول نموذج توليد: تمثيل بالمحارف، جدول Bigram بالعدّ، توليد ببذرة ثابتة، مقياس خسارة عادل، ومقارنة بالشبكة الصغيرة، وحد موثق يفتح سؤال السياق الأطول.",
     "content": {
      "ar": "content/chapter-03/ar.md",
      "en": "content/chapter-03/en.md",
      "status": "authored"
     },
     "title_en": "A First Model: From Counting to Weights",
     "goal_en": "From numbered units to a first generative model: character representation, a counting Bigram table, seed-fixed generation, a fair loss metric, a comparison with a small network, and a documented limit that opens the longer-context question."
    },
    {
     "id": "CH-4",
     "title_ar": "السياق والانتباه",
     "station_orders": [
      17,
      18,
      19,
      20,
      21
     ],
     "goal_ar": "أن يكتشف المتعلم مفاضلة السياق الأطول عبر تجارب N-gram (k=0..3) على البيانات نفسها: متى تضيف المعلومات السابقة قدرة تنبؤية، ومتى تتحول الندرة والتكلفة إلى عائق. المحطات العصبية هنا مراسي مؤجلة — تُفتح بعد أن يصبح سؤالها مُلحّاً بالتجربة.",
     "content": {
      "ar": "content/chapter-04/ar.md",
      "en": "content/chapter-04/en.md",
      "status": "authored"
     },
     "title_en": "Context and Attention",
     "goal_en": "That the learner discover the longer-context trade-off through N-gram experiments (k=0..3) on the same data: when previous tokens add predictive power, and when sparsity and cost become the obstacle. The neural stations here are deferred anchors — opened after their question becomes urgent by experiment."
    },
    {
     "id": "CH-5",
     "title_ar": "التدريب الآمن",
     "station_orders": [
      22,
      23,
      24,
      25
     ],
     "goal_ar": "أن يدرّب دون أن يرى النموذج الإجابة، وأن يتخذ قرار توقف مبني على تحقق.",
     "content": {
      "ar": "content/chapter-05/ar.md",
      "en": "content/chapter-05/en.md",
      "status": "authored"
     },
     "title_en": "Safe Training",
     "goal_en": "That they train without the model seeing the answer, and make a stopping decision grounded in validation."
    },
    {
     "id": "CH-6",
     "title_ar": "البناء والتقييم والتشغيل",
     "station_orders": [
      26,
      27,
      28,
      29,
      30
     ],
     "goal_ar": "أن يشغّل النموذج ويقيسه بحدود واضحة.",
     "content": {
      "ar": "content/chapter-06/ar.md",
      "en": "content/chapter-06/en.md",
      "status": "authored"
     },
     "title_en": "Build, Evaluate, and Run",
     "goal_en": "That they run the model and measure it within clear limits."
    },
    {
     "id": "CH-7",
     "title_ar": "الانتباه والوصول إلى معلومة سابقة",
     "station_orders": [
      31,
      32,
      33,
      34,
      35,
      36
     ],
     "goal_ar": "أن يفرّق المتعلم بين الاحتفاظ والعثور والاستخدام، ويقيس الوصول بمهمة مضبوطة بأزواج متقابلة وضوابط معلنة.",
     "content": {
      "ar": "content/chapter-07/ar.md",
      "en": "content/chapter-07/en.md",
      "status": "authored"
     },
     "title_en": "Attention and Access to Earlier Information",
     "goal_en": "That the learner distinguish retaining, finding, and using, and measure access with a controlled task using counterbalanced pairs and declared controls."
    },
    {
     "id": "CH-8",
     "title_ar": "من قارئ استعلام واحد إلى الانتباه الذاتي السببي",
     "station_orders": [
      37,
      38,
      39,
      40
     ],
     "goal_ar": "أن يميز المتعلم بين الاستعلام الثابت والمشتق من حالة الموضع، ويقرأ شبكة عاملية منضبطة بكامل خلاياها، ويفصل خريطة الانتباه عن الدليل التدخلي.",
     "content": {
      "ar": "content/chapter-08/ar.md",
      "en": "content/chapter-08/en.md",
      "status": "reviewed"
     },
     "title_en": "From a Single-Query Reader to Causal Self-Attention",
     "goal_en": "That the learner distinguish the fixed query from the state-derived one, read a controlled factorial grid in full, and separate attention maps from interventional evidence."
    },
    {
     "id": "CH-9",
     "title_ar": "الارتباط التركيبي بين المفتاح والقيمة",
     "station_orders": [
      41,
      42,
      43,
      44
     ],
     "goal_ar": "أن يحول المتعلم الربط إلى سؤال قابل للقياس بأزواج مضادة، يكشف اختصارات السؤال الثاني ويفصلها عن الدليل، ويقرأ تفاعل العمق مع الترميز الموضعي بحدود مقارنته.",
     "content": {
      "ar": "content/chapter-09/ar.md",
      "en": "content/chapter-09/en.md",
      "status": "reviewed"
     },
     "title_en": "Compositional Binding Between Key and Value",
     "goal_en": "That the learner turn binding into a measurable question with counterfactual pairs, expose second-question shortcuts and separate them from the evidence, and read the depth-by-encoding interaction within its comparison limits."
    }
   ],
   "stations": [
    {
     "order": 1,
     "topic_id": "FND-002",
     "role": "core",
     "why_here_ar": "نبدأ من مشكلة يريد الإنسان حلها، لا من تقنية. هذا يحدد لاحقاً ما يُعد نجاحاً.",
     "deliverable_ar": "صياغة مشكلة واحدة بجملة قابلة للفحص: من يتأثر، وما السلوك المطلوب.",
     "activity": {
      "sees_ar": "ست رسائل قصيرة عن الاجتماع، وأربعة ردود متاحة فقط.",
      "tries_ar": "يصنّف كل رسالة يدوياً قبل أي أداة، ويسجل أي رسالة تردد فيها.",
      "hypothesis_ar": "أتوقع أن كل الرسائل ستنتمي إلى حالة واحدة من الأربع.",
      "possible_outcomes_ar": [
       "كلها تنتمي بلا تردد",
       "واحدة تحتمل حالتين",
       "واحدة على الأقل خارج الحالات الأربع"
      ],
      "interpretation_ar": "إن وجدت رسالة لا تنتمي، فالحالات نفسها تحتاج تعريفاً أدق. وإن انتمت كلها، فالمشكلة أضيق مما تظن، وهذا ليس نجاحاً بعد.",
      "discovers_ar": "المشكلة ليست في البرمجة بعد، بل في تعريف الحالات. وهذا ما ستختبره القواعد لاحقاً.",
      "sees_en": "Six short meeting messages and only four available replies.",
      "tries_en": "Classifies every message by hand before any tool, noting any message they hesitate on.",
      "hypothesis_en": "I expect all six messages to fall into one of the four cases.",
      "possible_outcomes_en": [
       "all fit without hesitation",
       "one admits two cases",
       "at least one falls outside the four"
      ],
      "interpretation_en": "If a message fits nowhere, the cases themselves need sharper definition. If all fit, the problem is narrower than you thought — and that is not success yet.",
      "discovers_en": "The problem is not in programming yet; it is in defining the cases. That is what the rules will test later."
     },
     "why_here_en": "We start from a problem a human wants solved, not from a technology. This later defines what counts as success.",
     "deliverable_en": "One problem stated in a testable sentence: who is affected, and what behavior is wanted."
    },